{
  "assetId": "quaternius-soft-step-turn-left-v1",
  "version": 1,
  "file": "assets/runtime/soft-step-turn-left-v1.glb",
  "sha256": "a658d2586ad2384d17b088b2caae30ec38f155d543c1b5895f4f5389ea99ed90",
  "rigId": "quaternius-superhero-male-65-v1",
  "rigMapping": "assets/manifests/quaternius-male-rig.json",
  "clipName": "EX_soft-step-turn__left__v1",
  "fps": 30,
  "durationMs": 10000,
  "loopable": false,
  "startPose": "soft-step-turn-left-start",
  "endPose": "soft-step-turn-left-start",
  "boundingBoxMeters": {
    "min": [-0.2867593274448918, -0.000010799520061695556, -0.2776562496237867],
    "max": [0.2863282752535973, 1.7895864106780555, 0.2379949207610989]
  },
  "requiredProps": [],
  "supportedSides": ["left"],
  "previewSeparationMs": 2000,
  "practiceRepetitions": 1,
  "authority": "animation",
  "reviewStatus": "draft"
}
