{
  "assetId": "quaternius-active-march-v1",
  "version": 1,
  "file": "assets/runtime/active-march-v1.glb",
  "sha256": "e9de3989f65b229441177cfd417309ad49b673328b98b18c7823a6e29dfca366",
  "rigId": "quaternius-superhero-male-65-v1",
  "rigMapping": "assets/manifests/quaternius-male-rig.json",
  "clipName": "EX_active-march__alternate__v1",
  "fps": 30,
  "durationMs": 8000,
  "loopable": false,
  "startPose": "active-march-alternate-start",
  "endPose": "active-march-alternate-start",
  "boundingBoxMeters": {
    "min": [-0.35129939878863276, -0.000021010562544091574, -0.16345077007413614],
    "max": [0.35129972050160374, 1.794586043684452, 0.2649908937799176]
  },
  "requiredProps": [],
  "supportedSides": ["alternate"],
  "previewSeparationMs": 2000,
  "practiceRepetitions": 1,
  "authority": "animation",
  "reviewStatus": "draft"
}
