{
  "assetId": "quaternius-v-pull-right-v1",
  "version": 1,
  "file": "assets/runtime/v-pull-right-v1.glb",
  "sha256": "3fe57e3479524ede577564cbd7bac6268b94887ecd9267a606ca2f5649869c08",
  "rigId": "quaternius-superhero-male-65-v1",
  "rigMapping": "assets/manifests/quaternius-male-rig.json",
  "clipName": "EX_v-pull__right__v1",
  "fps": 30,
  "durationMs": 10000,
  "loopable": false,
  "startPose": "v-pull-right-start",
  "endPose": "v-pull-right-start",
  "boundingBoxMeters": {
    "min": [-0.5068971189989518, -0.000021611248200081273, -0.23044943706736123],
    "max": [0.5313443988112567, 1.7195855547800405, 0.40183346311628054]
  },
  "requiredProps": ["ball"],
  "supportedSides": ["right"],
  "previewSeparationMs": 2000,
  "practiceRepetitions": 1,
  "authority": "animation",
  "reviewStatus": "draft"
}
