{
  "assetId": "quaternius-slow-breathing-v1",
  "version": 1,
  "file": "assets/runtime/slow-breathing-v1.glb",
  "sha256": "2cb821747e60e1eb9d2cd56926f7523777b31584092fa3f1e9ee82000861e132",
  "rigId": "quaternius-superhero-male-65-v1",
  "rigMapping": "assets/manifests/quaternius-male-rig.json",
  "clipName": "EX_slow-breathing__comfortable-standing__v1",
  "fps": 30,
  "durationMs": 8000,
  "loopable": false,
  "startPose": "slow-breathing-comfortable-standing-start",
  "endPose": "slow-breathing-comfortable-standing-start",
  "boundingBoxMeters": {
    "min": [-0.28632780578191686, -5.736644347071212e-7, -0.16345084791109926],
    "max": [0.28632828152191875, 1.8195867276105184, 0.1280376157646641]
  },
  "requiredProps": [],
  "supportedSides": ["none"],
  "previewSeparationMs": 2000,
  "practiceRepetitions": 1,
  "authority": "animation",
  "reviewStatus": "draft"
}
