{
  "assetId": "quaternius-ankle-mobility-left-v1",
  "version": 1,
  "file": "assets/runtime/ankle-mobility-left-v1.glb",
  "sha256": "7fa938d70f7f8e78e331edceee031feb8cf1fc63dfdb0bbd95c2748cf361c0ec",
  "rigId": "quaternius-superhero-male-65-v1",
  "rigMapping": "assets/manifests/quaternius-male-rig.json",
  "clipName": "EX_ankle-mobility__left__v1",
  "fps": 30,
  "durationMs": 8000,
  "loopable": false,
  "startPose": "ankle-mobility-left-start",
  "endPose": "ankle-mobility-left-start",
  "boundingBoxMeters": {
    "min": [-0.28632785122588744, -0.00004619531193370379, -0.35258312557420723],
    "max": [0.3163282734074209, 1.7695868459833484, 0.3760789347956963]
  },
  "requiredProps": [],
  "supportedSides": ["left"],
  "previewSeparationMs": 2000,
  "practiceRepetitions": 1,
  "authority": "animation",
  "reviewStatus": "draft"
}
